{
  "doc_id": "bank-001",
  "doc_type": "bank_notice",
  "language": "mr-IN",
  "is_synthetic": true,
  "fields": [
    { "name": "account_holder", "type": "name", "value": "चाचणी खातेदार" },
    { "name": "account_number", "type": "id", "value": "9876543210" },
    { "name": "notice_amount", "type": "amount", "value": "₹5,000.00" },
    { "name": "notice_date", "type": "date", "value": "01/09/2026" }
  ],
  "qa_pairs": [
    {
      "question": "नोटीसमधील रक्कम किती आहे?",
      "answer": "₹5,000.00",
      "supporting_text": "देय रक्कम: ₹5,000.00"
    },
    {
      "question": "खाते क्रमांक काय आहे?",
      "answer": "9876543210",
      "supporting_text": "खाते क्रमांक: 9876543210"
    }
  ]
}
