{
  "doc_id": "rx-001",
  "doc_type": "prescription",
  "language": "hi-IN",
  "is_synthetic": true,
  "fields": [
    { "name": "patient_name", "type": "name", "value": "परीक्षण रोगी" },
    { "name": "doctor_name", "type": "name", "value": "डॉ. परीक्षण वैद्य" },
    { "name": "medicine_1", "type": "text", "value": "परासिटामोल 500mg" },
    { "name": "date", "type": "date", "value": "01/10/2026" }
  ],
  "qa_pairs": [
    {
      "question": "मरीज़ का नाम क्या है?",
      "answer": "परीक्षण रोगी",
      "supporting_text": "रोगी: परीक्षण रोगी"
    },
    {
      "question": "कौन सी दवाई लिखी गई है?",
      "answer": "परासिटामोल 500mg",
      "supporting_text": "दवाई: परासिटामोल 500mg"
    },
    {
      "question": "पर्चे की तारीख क्या है?",
      "answer": "01/10/2026",
      "supporting_text": "तारीख: 01/10/2026"
    }
  ]
}
