{
  "doc_id": "elec-001",
  "doc_type": "electricity_bill",
  "language": "en-IN",
  "is_synthetic": true,
  "fields": [
    { "name": "consumer_name", "type": "name", "value": "Test Electricity Consumer" },
    { "name": "account_number", "type": "id", "value": "TEST-001-2026" },
    { "name": "total_amount_due", "type": "amount", "value": "₹999.00" },
    { "name": "due_date", "type": "date", "value": "15/11/2026" }
  ],
  "qa_pairs": [
    {
      "question": "How much do I owe?",
      "answer": "₹999.00",
      "supporting_text": "TOTAL AMOUNT DUE: ₹999.00"
    },
    {
      "question": "When is the due date?",
      "answer": "15/11/2026",
      "supporting_text": "Due Date: 15/11/2026"
    },
    {
      "question": "What is the account number?",
      "answer": "TEST-001-2026",
      "supporting_text": "Consumer Account: TEST-001-2026"
    }
  ]
}
